{
  "$schema": "../schemas/release-gap-register.v1.schema.json",
  "format": "honua.release-gap-register.v1",
  "schemaVersion": "1.0.0",
  "asOf": "2026-08-08",
  "generatedFrom": [
    "audits/capabilities/*.json",
    "audits/release-gaps.v1.json"
  ],
  "severityVocabulary": {
    "P0": "Release blocker: unsupported GA claim, security/data-integrity risk, broken core job, or absent live proof/rollback.",
    "P1": "High: cross-SDK/protocol/day-two/performance/documentation gap.",
    "P2": "Planned: intentionally outside the current GA target."
  },
  "gaps": [
    {
      "id": "GA-001",
      "severity": "P0",
      "classifications": [
        "false-or-unsupported-ga-claim"
      ],
      "title": "Reconcile public GA vocabulary with release artifacts",
      "affected": [
        {
          "auditId": "cog-direct-read",
          "jobId": "job.cog-direct-read",
          "capabilityKey": "raster.cloud-cog-serving",
          "gaClaim": false,
          "targetTier": "ga",
          "claim": "Discover a reviewed COG, enforce bounded ranges/decoded windows, and inspect or render the result."
        },
        {
          "auditId": "feature-query-first-map",
          "jobId": "job.first-map",
          "capabilityKey": "serve.geoservices-featureserver",
          "gaClaim": false,
          "targetTier": "ga",
          "claim": "Connect an anonymous endpoint, inspect it, run a bounded feature query, and render an accessible first map."
        },
        {
          "auditId": "geoparquet-geoarrow-query",
          "jobId": "job.geoparquet-geoarrow-query",
          "capabilityKey": "serve.geoservices-featureserver",
          "gaClaim": false,
          "targetTier": "ga",
          "claim": "Run a bounded feature query preserving CRS, geometry, attributes, nulls, dictionaries, and int64 in GeoParquet/GeoArrow."
        },
        {
          "auditId": "ogc-api-coverages",
          "jobId": "job.ogc-api-coverages",
          "capabilityKey": "serve.ogc-api-coverages",
          "gaClaim": false,
          "targetTier": "ga",
          "claim": "Discover a coverage and retrieve a bounded subset with explicit format, CRS, limits, and errors."
        },
        {
          "auditId": "pmtiles-range-and-lifecycle",
          "jobId": "job.pmtiles",
          "capabilityKey": "serve.vector-tiles",
          "gaClaim": false,
          "targetTier": "ga",
          "claim": "Read PMTiles v3 by range and, only when claimed, archive/publish/status/cancel without inventing register/delete."
        },
        {
          "auditId": "stac-search",
          "jobId": "job.stac-search",
          "capabilityKey": "serve.stac",
          "gaClaim": false,
          "targetTier": "ga",
          "claim": "Browse STAC 1.0.0 collections/items and execute bounded GET/POST search against a candidate catalog."
        },
        {
          "auditId": "wcs-201",
          "jobId": "job.wcs-getcoverage",
          "capabilityKey": "serve.wcs",
          "gaClaim": false,
          "targetTier": "ga",
          "claim": "Run GetCapabilities, DescribeCoverage, and bounded GetCoverage with explicit output and CRS."
        }
      ],
      "userCompetitiveImpact": "Buyers can read 'GA-tier core' while the site says source evaluation and no immutable server release exists; production commitments are therefore unauditable.",
      "risk": {
        "security": "medium",
        "dataLoss": "low",
        "compatibility": "high"
      },
      "evidenceMissing": [
        "docs-troubleshooting"
      ],
      "currentWorkaround": "Treat every audited row as evaluation/prerelease and use the generated matrix rather than inferring GA from Implemented, supported, covered, or stable.",
      "dependencyChain": [
        "https://github.com/honua-io/honua-release/issues/58",
        "https://github.com/honua-io/honua-release/issues/59",
        "https://github.com/honua-io/honua-release/issues/60"
      ],
      "owner": {
        "team": "Release Engineering",
        "repository": "honua-io/honua-release"
      },
      "existingIssue": "https://github.com/honua-io/honua-release/issues/58",
      "effort": {
        "estimate": "M",
        "confidence": "high"
      },
      "recommendedSequence": 1,
      "exitEvidence": [
        "One authoritative vocabulary maps producer statuses to GA without implication.",
        "The release gate rejects public GA keys outside the evidenced-GA set.",
        "Site and server claims derive from the passed decision."
      ]
    },
    {
      "id": "GA-002",
      "severity": "P0",
      "classifications": [
        "false-or-unsupported-ga-claim"
      ],
      "title": "Pin immutable server image, commit, and evidence lineage",
      "affected": [
        {
          "auditId": "cog-direct-read",
          "jobId": "job.cog-direct-read",
          "capabilityKey": "raster.cloud-cog-serving",
          "gaClaim": false,
          "targetTier": "ga",
          "claim": "Discover a reviewed COG, enforce bounded ranges/decoded windows, and inspect or render the result."
        },
        {
          "auditId": "feature-query-first-map",
          "jobId": "job.first-map",
          "capabilityKey": "serve.geoservices-featureserver",
          "gaClaim": false,
          "targetTier": "ga",
          "claim": "Connect an anonymous endpoint, inspect it, run a bounded feature query, and render an accessible first map."
        },
        {
          "auditId": "geoparquet-geoarrow-query",
          "jobId": "job.geoparquet-geoarrow-query",
          "capabilityKey": "serve.geoservices-featureserver",
          "gaClaim": false,
          "targetTier": "ga",
          "claim": "Run a bounded feature query preserving CRS, geometry, attributes, nulls, dictionaries, and int64 in GeoParquet/GeoArrow."
        },
        {
          "auditId": "ogc-api-coverages",
          "jobId": "job.ogc-api-coverages",
          "capabilityKey": "serve.ogc-api-coverages",
          "gaClaim": false,
          "targetTier": "ga",
          "claim": "Discover a coverage and retrieve a bounded subset with explicit format, CRS, limits, and errors."
        },
        {
          "auditId": "pmtiles-range-and-lifecycle",
          "jobId": "job.pmtiles",
          "capabilityKey": "serve.vector-tiles",
          "gaClaim": false,
          "targetTier": "ga",
          "claim": "Read PMTiles v3 by range and, only when claimed, archive/publish/status/cancel without inventing register/delete."
        },
        {
          "auditId": "stac-search",
          "jobId": "job.stac-search",
          "capabilityKey": "serve.stac",
          "gaClaim": false,
          "targetTier": "ga",
          "claim": "Browse STAC 1.0.0 collections/items and execute bounded GET/POST search against a candidate catalog."
        },
        {
          "auditId": "wcs-201",
          "jobId": "job.wcs-getcoverage",
          "capabilityKey": "serve.wcs",
          "gaClaim": false,
          "targetTier": "ga",
          "claim": "Run GetCapabilities, DescribeCoverage, and bounded GetCoverage with explicit output and CRS."
        }
      ],
      "userCompetitiveImpact": "Customers cannot reproduce or roll back a candidate when tests are not tied to an image digest and commit.",
      "risk": {
        "security": "high",
        "dataLoss": "medium",
        "compatibility": "high"
      },
      "evidenceMissing": [
        "server-conformance",
        "server-image",
        "server-observability",
        "server-security"
      ],
      "currentWorkaround": "Run trunk/nightly images as evaluation-only and record commits manually.",
      "dependencyChain": [
        "https://github.com/honua-io/honua-release/issues/58",
        "https://github.com/honua-io/honua-release/issues/59",
        "https://github.com/honua-io/honua-release/issues/60"
      ],
      "owner": {
        "team": "Release Engineering",
        "repository": "honua-io/honua-release"
      },
      "existingIssue": "https://github.com/honua-io/honua-release/issues/58",
      "effort": {
        "estimate": "L",
        "confidence": "high"
      },
      "recommendedSequence": 2,
      "exitEvidence": [
        "Candidate image digest resolves to the audited server commit.",
        "Conformance, security, limits/errors, performance, and observability receipts name that digest.",
        "A rollback drill restores the previous digest."
      ]
    },
    {
      "id": "GA-003",
      "severity": "P0",
      "classifications": [
        "absent-live-proof",
        "absent-rollback"
      ],
      "title": "Add capability canaries, reset, rollback, and incident ownership",
      "affected": [
        {
          "auditId": "cog-direct-read",
          "jobId": "job.cog-direct-read",
          "capabilityKey": "raster.cloud-cog-serving",
          "gaClaim": false,
          "targetTier": "ga",
          "claim": "Discover a reviewed COG, enforce bounded ranges/decoded windows, and inspect or render the result."
        },
        {
          "auditId": "feature-query-first-map",
          "jobId": "job.first-map",
          "capabilityKey": "serve.geoservices-featureserver",
          "gaClaim": false,
          "targetTier": "ga",
          "claim": "Connect an anonymous endpoint, inspect it, run a bounded feature query, and render an accessible first map."
        },
        {
          "auditId": "geoparquet-geoarrow-query",
          "jobId": "job.geoparquet-geoarrow-query",
          "capabilityKey": "serve.geoservices-featureserver",
          "gaClaim": false,
          "targetTier": "ga",
          "claim": "Run a bounded feature query preserving CRS, geometry, attributes, nulls, dictionaries, and int64 in GeoParquet/GeoArrow."
        },
        {
          "auditId": "ogc-api-coverages",
          "jobId": "job.ogc-api-coverages",
          "capabilityKey": "serve.ogc-api-coverages",
          "gaClaim": false,
          "targetTier": "ga",